additionalInfo,address,city,description,district,flatFloor,floorsCount,house,price,remoteness,remotenessType,roomsNumber,squareKitchen,squareLive,squareTotal,street,underground,"Москва, район Аэропорт, ул. Самеда Вургуна, 1",Москва,"Татьяна. Вашему вниманию предлагается пятикомнатная квартира в сталинском доме. В культурно-историческом районе Москвы. Закрытая придомовая территория, на которой расположены несколько гаражей. В стоимость нашей квартиры входит один гараж (находится в собственности, более трёх лет). Чистый подъезд с новым ремонтом. Презентабельная входная группа. В квартире находятся - три спальни, две детские, два совмещённых санузла-кафель до потолка. Гардеробная комната, кладовка, темная комната для хозяйственных нужд. Просторная кухня - со встроенный бытовой техникой. Два балкона , французские окна. Установлены четыре кондиционера. Пешая доступность до двух станций метро. Очень развитая инфраструктура. Прекрасный пруд и парк виден из окна. Правоустанавливающим документам более трёх лет. Лёгкая альтернатива. Оперативный показ. Лучшее предложение!! Звоните уважаемые коллеги и клиенты.",район Аэропорт,7,7,д.1,40 000 000,10,пешком,5,12,122,198,ул. Самеда Вургуна,м. Сокол
,"Москва, район Хамовники, ул. Остоженка, 11",Москва,"КЛЮЧИ НА РУКАХ! Оперативный показ! Торг уместен! Бонус гарантируем максимальный! ЖК ""Остоженка 11"" - комплекс класса DE LUXE, расположенный в центральном округе, в престижном районе Москвы, в области ""Золотой Мили"". Удобное месторасположение, развитая инфраструктура, пяти минутная прогулка приведет Вас на Крымскую набережную. ЖК построен в современном европейском стиле! Роскошная презентабельная входная группа! Дом монолитно-кирпичный, фасад здания снаружи отделан ценнейшими видами природного камня специально доставленного из Германии. квартира свободной планировки, высота потолков в квартире 3,3 метра, с огромными панорамными окнами, с алюминиевыми двойными стеклопакетами. Здание оснащено сверхточным автоматизированным оборудованием. Интеллектуальный дом способен сам позаботиться о комфорте и безопасности своих жителей. Единая диспетчерская система управляет работой сетей теплоснабжения, вентиляции, кондиционирования, водоснабжения, электричества, лифтов, противопожарной защиты здания. Предусмотрена круглосуточная аварийная служба. Внутренний дворик с детской площадкой, личным садом, аллеей, скамейками для вечернего променада, круглосуточная охрана, закрытая территория, двухуровневый подземный паркинг, на территории которого расположена придомовая мойка машин!",район Хамовники,2,6,д.11,112 524 436,7,пешком,3,,,"140,5",ул. Остоженка,м. Кропоткинская
,"Москва, район Хорошево-Мневники, просп. Маршала Жукова, 37К2",Москва,"Новый современный микрорайон. ЖК ""Велтон парк"". Грамотная планировка квартиры с 7ю окнами позволяет спланировать как просторную 3х комнатную так и 4х комнатную с изолированными комнатами и отдельной кухней квартиру. Удачное расположение секции дома и этаж открывает панорамные виды из окон, делает квартиру солнечной и видовой, позиционирование окон- восток юг запад. Есть машиноместо в подземном паркинге. Микрорайон бизнес класса с соответствующей инфраструктурой. В течение года открывается метро в шаговой доступности. Свободная продажа. Возможна ипотека.",район Хорошево-Мневники,17,17,д.37К2,25 000 000,7,на машине,,"16,4","42,6","92,5",просп. Маршала Жукова,м. Хорошёво
,"Москва, район Черемушки, Севастопольский просп., 42",Москва,"Дом после кап. ремонта, утеплен с вент. фасадом, чистый подъезд. Квартира в отличном состоянии, ст. пакеты, встр. кухня, шкаф. Зеленый район с развитой инфраструктурой: любые магазины и ТЦ, предприятия быт.обслуживания, школы и дет.сады - все в шаговой доступности, дет. поликлинника в этом же доме. Чистая продажа. Свободна. В собств более 3-х лет.",район Черемушки,8,9,д.42,5 700 000,5,на машине,1,7,19,33,Севастопольский просп.,м. Калужская
,,,,,,,,,,,,,,,,
,"Москва, район Таганский, Рабочая ул., 14",Москва,"Показываем сегодня ! Возможна продажа по жилищному сертификату , субсидии , военной ипотеке, социальной ипотеке. Покупатель только оплачивает стоймость квартиры +оформление+1 ячейку на 1 мес.(продажа с мат.капиталлом , возможна ).Квартира продается на данный момент.Документы в офисе . Первичная история , полная цена в договоре , окна во двор . Оперативный выход на сделку.Уникальность квартиры , что окна выходят на две стороны света. Окна выходят туда , где нет усилителей электромагнитных волн , можно отдыхать без головных болей в отличии от других домов.Квартира в ЦАО ! Особенности: есть подвесной потолок, домофон, сигнализация, видеонаблюдение . Прилегающая территория: есть сквер, парковая зона, детская площадка, фитнес-клуб, круглосуточный магазин, торговый центр, аптека .Если данной суммы нет или аванса за Вашу квартиру тоже и отсутствует одобрения банка по ипотеке-- просьба не беспокоить , уважайте своё время и время собственников.Уважаемые покупатели и их представители (стажёры) --не принимаются фразы , что аванс за Вашу квартиру типа есть , хотят внести за Вашу квартиру , при внесении аванса прописывается авансовое соглашение , где указываются даты выхода на сделку.",район Таганский,9,12,д.14,8 577 777,6,пешком,2,7,26,39,Рабочая ул.,м. Римская
,"Москва, район Пресненский, наб. Пресненская, 12",Москва,"Предлагаются в продажу 3 апартамента в Москва-Сити, здание ""Федерации"", Башня ""Запад"" (Пресненская набережная, дом 12), расположенные на 49-м этаже общей площадью - 115.8 кв. м, 110 кв. м и 221 кв. м соответственно. Все апартаменты рядом, соседние. В апартаментах сделан дизайнерский ремонт в едином стиле, полностью укомплектованы фешенебельной мебелью и бытовой техникой. Оборудованы системой Умный Дом. В данный момент сданы в аренду с правом сдачи в субаренду (стоимость аренды - 1,4 млн. рублей; доход от субаренды - 3,0 млн. рублей в месяц). Техническая возможность объединить все помещения имеется! Продаются единым лотом за 200 млн. рублей, включая НДС.",район Пресненский,49,62,д.12,200 000 000,4,пешком,,,,"446,6",наб. Пресненская,м. Международная
,"Москва, район Арбат, ул. Арбат, 24",Москва,"Роскошные 4-х комнатные апартаменты общей площадью 180,2 м2 с террасой (17м2). Без отделки. Панорамные окна. Высокие потолки. Прекрасный вид на центр столицы и тихие Арбатские переулки. Покупателям предлагается на выбор два дизайнерских интерьера апартаментов в стиле английского пригорода и Нью-Йорка 70-х. Окна здания имеют двойное остекление, выполнены из дуба, защищены алюминиевыми накладками с внешней стороны. Turandot Residences - эксклюзивный проект с дизайн-концепцией от Джейд Джаггер (Jade Jagger for yoo). Новый клубный дом класса De Luxe расположен в историческом месте Москвы. Созданы все условия для комфортной и красивой жизни: подземный паркинг, бассейн, фитнесс-центр, детская площадка, охраняемая территория, видеонаблюдение, круглосуточная охрана. Жилой комплекс оснащен новейшими инженерными системами в том числе центральным кондиционированием VRV III ""Daikin"". Отделка входной группы высококачественными материалами (мрамор, гранит). Дизайнерское освещение.",район Арбат,7,8,д.24,157 505 000,11,пешком,4,25,137,"180,2",ул. Арбат,м. Арбатская
,"Москва, район Арбат, ул. Арбат, 24",Москва,"Предлагается апартамент общей площадью 113,7 м2 на 4 этаже с большой террасой (26м2). Без отделки. Панорамные окна. Высокие потолки. Из апартамента открывается великолепный вид на центр столицы и тихие Арбатские переулки. Покупателям предлагается на выбор два дизайнерских интерьера апартаментов в стиле английского пригорода и Нью-Йорка 70-х. Окна здания имеют двойное остекление, выполнены из дуба, защищены алюминиевыми накладками с внешней стороны. Turandot Residences - эксклюзивный проект с дизайн-концепцией от Джейд Джаггер (Jade Jagger for yoo). Новый клубный дом класса De Luxe расположен в историческом месте Москвы. Созданы все условия для комфортной и красивой жизни: подземный паркинг, бассейн, фитнесс-центр, детская площадка, охраняемая территория, видеонаблюдение, круглосуточная охрана. Жилой комплекс оснащен новейшими инженерными системами в том числе центральным кондиционированием VRV III ""Daikin"". Отделка входной группы высококачественными материалами (мрамор, гранит). Дизайнерское освещение.",район Арбат,4,8,д.24,88 782 600,11,пешком,3,15,95,"113,7",ул. Арбат,м. Арбатская
,"Москва, район Бабушкинский, ул. Менжинского, 29",Москва,"Внимание! Прекрасная двухкомнатная квартира, распашонка, лоджия застекленная. Просторная кухня - встроенный кухонный гарнитур, СУС - кафель до потолка! Комнаты изолированные. Чистая, уютная квартира, два кондиционера (!). Огромный коридор. Дом с закрытой, огороженной, охраняемой территорией! Чистый подъезд, консъерж! Свободная продажа, оперативный показ! Звоните уважаемые коллеги и клиенты.",район Бабушкинский,9,22,д.29,11 100 000,8,пешком,2,11,33,58,ул. Менжинского,м. Бабушкинская
,"Москва, район Раменки, ул. Довженко, 8К2",Москва,"Предлагается трехкомнатная квартира в самом благополучном, благоприятном и престижном районе Москвы. Пешая доступность до метро Минская - 10 минут!!! Район расположен в долине реки Сетунь (дом в 20 метрах от реки). Прекрасная зона отдыха, парк, лес и озеро (Мосфильмовский пруд). Самый экологически чистый район Москвы в непосредственной близости к центру. Район очень тихий, т.к. нет сквозного проезда. Рядом расположен городской гольф-клуб, Парк победы, Поклонная гора, Воробьевы горы в пешей доступности. Замечательные места для велосипедных и пеших прогулок. Очень хорошая инфраструктура: детский сад в 100 метрах от дома, Шуваловская гимназия в 100 метрах от дома, МГУ находится в 4 остановках на автобусе или 5 минут на машине. Высокий первый этаж. Решетки на окнах - ПВХ. Большая утепленная и застекленная лоджия - 6 метров. СУР - кафель до потолка, ванна. Во дворе всегда есть парковочные места. Легкая альтернатива. Оперативный показ. Звоните уважаемые клиенты и коллеги.",район Раменки,1,16,д.8К2,11 600 000,10,пешком,3,8,46,65,ул. Довженко,м. Минская
,"Москва, район Измайлово, Сиреневый бул., 28",Москва,"Отличная, светлая, уютная квартира! На данный момент в коридоре есть мебель а точнее встроенные шкафы. Тихие супер адекватные соседи, новая детская площадка. Рядом 3 детских сада+ школы. В доме 2 магазина, очень удобная транспортная доступность. Рядом Спортивный комплекс с бассейном и разными видами спорта. Шикарный и зеленый Измайловский парк. В собственности более 7 лет. Я единственный Собственник, прописаны 2е несовершенных детей не наделены правом собственности, просто прописаны! Альтернатива в том же районе есть, МК но это обсуждается. Агенты звонящие для продажи моей квартиры, идите в лес! Даже общаться не буду!! В базу для общего прозвона не добавлять если не тупые. Обращу еще раз внимание ко всем добр, кто звонит по делу, а не для предложения своих услуг! У меня есть Агент который окажет сопровождение сделки!",район Измайлово,7,8,д.28,6 300 000,11,пешком,1,5,19,"30,3",Сиреневый бул.,м. Первомайская
,"Москва, район Люблино, ул. Перерва, 72",Москва,"Прекрасная просторная квартира в хорошем состоянии, готова к проживанию. Окна ПВХ, на полу ламинат-плитка, стены обои. Балкон застеклен, санузел весь в кафеле. Большая гардеробная, широкий холл, что поместился диван. Хорошие спокойные соседи. Район с развитой инфраструктурой: школы, детские сады, спортивные комплексы, поликлиники, магазины, банки, аптеки. Один взрослый собственник, более трех лет.",район Люблино,23,24,д.72,6 300 000,19,пешком,1,9,21,45,ул. Перерва,м. Люблино
,"Москва, район Беговой, Ленинградский просп., вл31",Москва,"ID615509 Продается 2-комн. кв-ра площадью 68,8 кв.м на 8 этаже монолитного дома в МФК ""Царская площадь"". Жилой комплекс бизнес-класса расположен в историческом районе Москвы, рядом с Петровским парком и знаменитым Путевым дворцом. Комплекс состоит из четырех корпусов, образующих единое общественное пространство с прогулочной зоной: летом можно любоваться фонтанами, а зимой кататься на коньках. Для комфорта жителей рядом находится вся необходимая инфраструктура: пекарни и магазины, кофейни и рестораны, фитнес-центры и студии. Удачное расположение позволяет пользоваться любым видом транспорта МФК имеет удобный выезд на Ленинградский проспект и ТТК, а до станции метро Динамо всего 5 мин. пешком. Для автомобилей в комплексе предусмотрен подземный паркинг. КЛЮЧИ ОТ КВАРТИР В 1-Й ОЧЕРЕДИ УЖЕ В ЭТОМ ГОДУ!",район Беговой,8,21,д.вл31,15 324 545,5,пешком,2,,,"68,8",Ленинградский просп.,м. Динамо
,"Москва, район Пресненский, наб. Пресненская, 12",Москва,"Предлагаются в продажу Апартаменты в Москва-Сити, здание ""Федерации"", Башня ""Запад"" (Пресненская набережная, дом 12), расположенные на 49-м этаже общей площадью - 190 кв.м. Апартаменты с шикарным видом на город. Апартаменты под чистовую отделку. Имеют три входа, один центральный и два боковых (видно на плане). В данный момент сданы в аренду за 500 000 рублей в месяц.",район Пресненский,49,62,д.12,75 000 000,4,пешком,,,190,190,наб. Пресненская,м. Международная
,"Москва, район Нижегородский, Газгольдерная ул.",Москва,"Продается 2 комнатная квартира площадью 61.24 кв.м на 15 этаже 25-ти этажного дома (корпус Т2) в ЖК SREDA. Комфорт-класс, ЮВАО, переменная этажность домов, квартальная застройка с разделением общественного и частного сектора. Возможна перепланировка . На территории квартала продумана развитая инфраструктура (собств. детск. сад, школа, магазины, кафе, спорт учреждения, офисы, ритейл). Во дворах предусмотрены спортивные и детские площадки, пешеходные и спортивные зоны, велодорожки. На территории двора реализуется концепция ""двор без машин"". Для автовладельцев предусмотрен наземный и подземный паркинг. Удобная транспортная доступность. 5 мин до м. ""Нижегородская улица"". Стройка идет с опережением графика на 4 месяца. Квартира угловая с 5 окнами. Окна квартиры выходят на 2 стороны: на ТЦ Город и на Рязанский проспект.",район Нижегородский,15,25,,10 200 000,5,пешком,2,"9,7","30,8","61,2",Газгольдерная ул.,м. Нижегородская
