additionalInfo,address,city,description,district,floor,house,objectType,price,remoteness,remotenessType,square,street,underground,"Москва, район Обручевский, Ленинский просп., 107к2",Москва,"Представитель отдела продаж на объекте. Лот 44336. Предложение от собственника! Предлагается квартира без отделки. Функциональная планировка: 2 просторные спальни по 30м, холл, 2 с/у, кухня, имеется 2 лоджии. Жилой комплекс бизнес-класса ""Квартал 38А"" Проект включает в себя 9 жилых домов высотой от 6 до 22 этажей, с прекрасно развитой инфраструктурой: рядом с комплексом работают несколько школ, больниц, детских садов, учреждений сферы обслуживания и индустрии развлечений. По проекту первые этажи жилых корпусов предполагаются нежилыми здесь площади отведены под магазины, аптеки, салоны красоты и прочие инфраструктурные объекты. В пешей доступности от ЖК ""Квартал 38А"" расположены Воронцовский парк с прудами и Тропаревский лесопарк. Все корпуса комплекса возводятся по монолитной технологии, фасады отделываются мрамором и керамогранитом. Первые этажи корпусов отведены под нежилой фонд, на подземных уровнях спроектирован паркинг. Все здания оснащены современными коммуникациями и обеспечены надлежащей охраной. Удобная локация. До метро проще всего добраться на общественном транспорте за 15 минут можно доехать на выбор сразу до трех станций метрополитена: ""Проспект Вернадского"", ""Юго-Западная"" и ""Калужская"". Недалеко от комплекса проходят Ленинский проспект и Профсоюзная улица. Расстояние до МКАД отсюда примерно 5,5 км, до Третьего транспортного кольца 8 км.",район Обручевский,16/22,д.107к2,2-комн. кв.,23 500 000,10 мин. пешком,,,Ленинский просп.,м. Калужская
,"Москва, район Раменки, Мосфильмовская ул., 8",Москва,"Квартира свободной планировки без отделки площадью 150 кв.м. в малоэтажной секции Б в ЖК ""Дом на Мосфильмовской"" архитектора С. Скуратова. Планировка помещения позволяет сделать: 2 отдельные спальни с большой кухней-гостиной, либо 3 отдельные комнаты с кухней-столовой. Ключевой особенностью квартиры являются ее уникальные виды на исторический центр Москвы, без ущерба для безопасности и комфорта. Секция Б находится в удалении от оживленной Мосфильмовской улицы. Высота потолков составляет более 3-х метров. В квартире установлены качественные стеклопакеты. На территории комплекса есть детский городок и спортивная площадка, предусмотрено кафе и торгово-развлекательный комплекс. В доме трехуровневый подземный паркинг на 1160 машиномест.",район Раменки,12/12,д.8,2-комн. кв.,50 999 900,23 мин. пешком,,,Мосфильмовская ул.,м. Парк Победы
,"Москва, район Аэропорт, Кочновский проезд, 4к2",Москва,"ЖК Аэробус. Стильная просторная квартира с тремя окнами и качественным дизайнерским евро-ремонтом. Планировка ""распашонка"". В отделке использовались отделочные материалы премиум сегмента. Функциональная планировка: просторная столовая-гостиная, кухня, спальня, гардеробная комната,ванная, санузел. Квартира продается ""под ключ""-с мебелью, диванами, столами, встроенной бытовой техникой. Кухонный гарнитур со встроенной бытовой техникой изготавливался под заказ (микроволновая печь, духовая печь встроены). Духовая печь Bosh, посудомоечная машина Neff, холодильник LIEBHER. В квартире заменены все три окна на трехслойные дорогостоящие стеклопакеты, выполнена усиленная шумоизоляция, очень тихо. Организована многоуровневая подсветка. Кондиционирование, теплые полы. Для отделки пола использован натуральный паркет и итальянский керамогранит. Квартира солнечная, светлая, чистейшая! Высота потолков 3,1 м. Свободная продажа. Вся сумма в договоре. ЖК ""Аэробус"" -монолитный 32-х этажный комплекс бизнесс-класса. Охраняемая огороженная территория, КПП на въезде, пропускной режим. Консьерж. Детская и спортивная площадки. Благоустроенная придомовая территория. Подземный паркинг -3 этажа и гостевая парковка, автомойка, химчистка. Салон красоты, стоматологическая клиника, фитнес-клуб, 3 магазина, винный бутик, аптека, банкоматы. В трех минутах пешей доступности роскошный Тимирязевский парк с прудами. М. Аэропорт -12 мин. Пешком. Удобный транспортный выезд на Тверскую ул, 3-е транспортное кольцо направо и налево. , Москва, Северный административный округ, Кочновский проезд 4к2, м. Аэропорт, 2 комн., общ. пл. 88 кв.м., жил.пл. 40 кв.м., комнаты 26/14, кухня 14 кв.м., 4/32 этаж, окна улица, 2 санузла",район Аэропорт,4/32,д.4к2,2-комн. кв.,22 600 000,12 мин. пешком,,,Кочновский проезд,м. Аэропорт
,,,,,,,,,,,,,
,"Москва, район Замоскворечье, Садовническая ул., 51С1",Москва,"036446 Квартира с дизайнерским ремонтом, с итальянской мебелью и встроенной техникой в историческом центре Замоскворечья. Паркет, венецианская штукатурка, деревянные стеклопакеты, кухня, встроенные итальянские шкафы, джакузи. Высокие потолки 3,20 метра. Встроенный кухонный гарнитур, вся необходимая бытовая техника. Совмещенный санузел оборудован качественной сантехникой. Окна выходят в тихий двор. Паркинг наземный во дворе дома.",район Замоскворечье,2/6,д.51С1,2-комн. кв.,17 499 900,,,,Садовническая ул.,м. Новокузнецкая
,"Москва, район Красносельский, Краснопрудная ул., 1",Москва,"017597 Предлагается небольшая и светлая квартира. В квартире предусмотрены две комнаты, из всех окон вид на Универмаг Московский. В квартире сделан новый качественный евроремонт. Учитывая местоположение, данная квартира является хорошим предложением для организации арендного бизнеса.",район Красносельский,6/9,д.1,2-комн. кв.,22 700 000,,,,Краснопрудная ул.,м. Комсомольская
,"Москва, район Донской, Варшавское ш., 9",Москва,"022489 Уникальный лофт в комплексе ""Даниловская мануфактура"". Лофт со вторым светом (16 кв. м), что позволило создать полнофункциональную планировку с кухней, гостиной, спальней и санузлом. В лофте выполнен оригинальный ремонт в стиле арт-деко с использованием качественных отделочных материалов. В обустройстве интерьера использована мебель известных брендов: Kenas, Labyrinthe interiors, Pomax, Fauteuil Vitoria, Fancy, Chehoma. Благодаря двум большим окнам, лофт воспринимается очень светлым и визуально объемным.",район Донской,3/4,д.9,2-комн. кв.,22 900 000,,,,Варшавское ш.,м. Тульская
,"Москва, район Дорогомилово, Кутузовский просп., 26К1",Москва,"035626 Предлагается на продажу прекрасная 2-х комнатная квартира с отделкой в современном стиле. Планировка: кухня-гостиная, спальня, гардеробная, с/у. Виды из окон на Кутузовский проспект. Паркинг во дворе на закрытой территории.",район Дорогомилово,8/8,д.26К1,2-комн. кв.,23 000 000,,,,Кутузовский просп.,м. Студенческая
,"Москва, район Пресненский, Большая Никитская ул., 31",Москва,"035597 Двухкомнатные апартаменты расположены на 5 этаже дореволюционного доходного дома. Интерьер оформлен по авторскому проект из премиальных материалов. Планировка апартамента: кухня, гостиная, спальня, санузел. Высота потолков 3,35 метра. Панорамный вид на Б. Никитскую улицу и храм, в котором венчался Пушкин.",район Пресненский,5/6,д.31,2-комн. кв.,24 086 591,,,,Большая Никитская ул.,м. Арбатская
,"Москва, район Раменки, Мосфильмовская ул., 8",Москва,"Лот 19307. Видовая квартира с дизайнерской отделкой в классическом стиле. Гостиная с кухней, 3 спальни, 3 гардеробные, 3 санузла, постирочная. Использованы качественные материалы от лучших европейских производителей. Квартира полностью оборудована мебелью, бытовой техникой Miele, предметами декора. Во всей квартире установлены панорамные окна. Готовность к проживанию начало марта 2018. Жилой комплекс построен по проекту московского архитектора Сергея Скуратова. Комплекс представляет собой жилой дом класса De Luxe. Он мог бы украсить любую столицу мира, благодаря внешней красоте и внутреннему совершенству, которые настолько гармоничны, что его смело можно назвать домом из будущего. Окна квартир открывают великолепные виды на Парк Победы, Новодевичий монастырь, озера гольф-клуба, парк МГУ и всю огромную панораму столицы. Прекрасное расположение ""Дом на Мосфильмовской"" гарантирует хорошую транспортную доступность. Мы гарантируем нашим покупателям бесплатное юридическое сопровождение и чистоту сделок.",район Раменки,12/53,д.8,4-комн. кв.,82 000 000,5 мин. на машине,,,Мосфильмовская ул.,м. Парк Победы
,"Москва, район Замоскворечье, Мытная ул., 7с2",Москва,"Продажа от собственника .Квартира без ремонта это квартира с чистого листа. Первый собственник с момента постройки. Дом бизнес класса. Закрытая дворовая территория с видеонаблюдением и службой консьержей. Свободная планировка, позволяет реализовать свой дизайн проект и планировку комнат. Два санузла: домашний и гостевой и две застеклённые лоджии. Высокие потолки (3.1 м). Дом расположен в глубине комплекса.Квартира полностью подготовлена к продаже. Собственник владеет квартирой более трех лет! Оперативно познакомим с квартирой в удобное для вас время!",район Замоскворечье,8/17,д.7с2,4-комн. кв.,53 500 000,8 мин. пешком,,,Мытная ул.,м. Серпуховская
,"Москва, район Щукино, Авиационная ул., 79К1",Москва,"Эксклюзив.В продажу предлагается ВИДОВАЯ 4-х комнатная квартира с качественным ремонтом в современном стиле в светлых тонах. Функциональная планировка предусматривает: просторная кухня-гостиная, три спальни, два санузла, просторная гардеробная, кухня. Есть машиноместо на 1 уровне подзенмного паркинга за отдельную цену. ЖК ""Алые Паруса"" построен непосредственно на берегу Москва-реки. Огороженная охраняемая территория. На территории: бассейн с аквапарком, спортивные залы, крытые теннисные корты, футбольное поле, детские площадки, прогулочные зоны, рестораны, супермаркет, причал для яхт и многое другое. Комплекс не имеет аналогов в столице! Номер лота 67672",район Щукино,40/49,д.79К1,4-комн. кв.,40 000 000,10 мин. пешком,,,Авиационная ул.,м. Щукинская
,"Москва, район Щукино, Авиационная ул., 79К1",Москва,"В продажу предлагается видовая 4-х комнатная квартира с ремонтом. Все окна- вода. Планировка: кухня-гостиная, 3 спальни , два санузла, гардеробная. ЖК ""Алые Паруса"" построен непосредственно на берегу Москва-реки. Огороженная охраняемая территория.На территории: бассейн с аквапарком, спортивные залы, крытые теннисные корты, футбольное поле, детские площадки, прогулочные зоны, рестораны, супермаркет, причал для яхт и многое другое. Комплекс не имеет аналогов в столице. Номер лота 68759",район Щукино,33/49,д.79К1,4-комн. кв.,44 000 000,10 мин. пешком,,,Авиационная ул.,м. Щукинская
,"Москва, район Щукино, Авиационная ул., 79В",Москва,"В продажу предлагается ВИДОВАЯ 4-х комнатная квартира с дорогим ремонтом в стиле современная классика в ЖК ""Алые Паруса"". Планировка: кухня-столовая с панорамным видом на Москву-реку, просторная светлая гостиная с большим количеством окон. Детская спальня рядом с большим санузлом и гардеробом. Хозяйская зона со своим просторным санузлом, гардеробной и отдельным кабинетом. Дорогая итальянская мебель из массива дерева, встроенные системы кондиционирования с притоком свежего воздуха, системы видеонаблюдения и охраны. ЖК ""Алые Паруса"" построен непосредственно на берегу Москва-реки. Огороженная охраняемая территория. На территории: бассейн с аквапарком, спортивные залы, крытые теннисные корты, футбольное поле, детские площадки, прогулочные зоны, рестораны, супермаркет, причал для яхт и многое другое. Комплекс не имеет аналогов в столице! Номер лота 68237",район Щукино,27/32,д.79В,4-комн. кв.,56 900 000,10 мин. пешком,,,Авиационная ул.,м. Щукинская
,"Москва, район Раменки, Мосфильмовская ул., 8",Москва,"Предлагается квартира без отделки. Планируется кухня-гостиная, 3 спальни, 3 санузла. Удобная планировка. Виды на Гольф-клуб, Парк Победы, Воробьевы горы, МГУ. Высота потолков 3,3 метра. ОФИС ПРОДАЖ квартир в ЖК ""ДОМ НА МОСФИЛЬМОВСКОЙ"". Самый эффектный и модный небоскреб рядом с центром Москвы с неповторимым авторским решением от известного архитектора Сергея Скуратова. Удобная транспортная доступность, до Кремля 10 мин. Уютная огороженная территория с площадкой для спорта и отдыха с детьми, салоны красоты, квалифицированная круглосуточная охрана, видеонаблюдение, трехуровневый подземный паркинг с автомойкой. Секция В1. ВОЗНАГРАЖДЕНИЕ АГЕНТАМ. ОПЕРАТИВНЫЙ ПОКАЗ! Прямой представитель собственника - Ковалева Анна.",район Раменки,5/33,д.8,4-комн. кв.,43 500 000,11 мин. пешком,,,Мосфильмовская ул.,м. Парк Победы
,"Москва, район Раменки, Мосфильмовская ул., 8",Москва,"ВЫГОДНАЯ ЦЕНА! Предлагается квартира без отделки. Планируется кухня-гостиная, 3 спальни, 3 с/у. Удобная линейная планировка. Виды на Гольф-клуб, Парк Победы, МГУ. Есть машино-место в подземном паркинге. ОФИС ПРОДАЖ квартир в ЖК ""ДОМ НА МОСФИЛЬМОВСКОЙ"". Самый эффектный и модный небоскреб рядом с центром Москвы с неповторимым авторским решением от известного архитектора Сергея Скуратова. Удобная транспортная доступность, до Кремля 10 мин. Уютная огороженная территория с площадкой для спорта и отдыха с детьми, салоны красоты, квалифицированная круглосуточная охрана, видеонаблюдение, трехуровневый подземный паркинг с автомойкой. Секция Б. ВОЗНАГРАЖДЕНИЕ АГЕНТАМ. ОПЕРАТИВНЫЙ ПОКАЗ! Прямой представитель собственника - Ковалева Анна.",район Раменки,9/11,д.8,4-комн. кв.,49 500 000,11 мин. пешком,,,Мосфильмовская ул.,м. Парк Победы
,"Москва, район Раменки, Мосфильмовская ул., 8",Москва,"Уютная квартира c абсолютно новой отделкой в стиле ""Современная классика"". Виды на центр города и в область. Планировка: 3 спальни, кухня -гостиная, 3 санузла, 2 гардеробные, комнаты хозяйственного назначения (постирочная). Панорамные окна, комфортный 12 этаж. Ремонт выполнен в светлых тонах. ОФИС ПРОДАЖ квартир в ЖК ""ДОМ НА МОСФИЛЬМОВСКОЙ"". Самый эффектный и модный небоскреб рядом с центром Москвы с неповторимым авторским решением от известного архитектора Сергея Скуратова. Удобная транспортная доступность, до Кремля 10 мин. Уютная огороженная территория с площадкой для спорта и отдыха с детьми, салоны красоты, квалифицированная круглосуточная охрана, видеонаблюдение, трехуровневый подземный паркинг с автомойкой. Секция В. ВОЗНАГРАЖДЕНИЕ АГЕНТАМ. ОПЕРАТИВНЫЙ ПОКАЗ! Прямой представитель собственника - Ковалева Анна.",район Раменки,12/33,д.8,4-комн. кв.,82 000 000,11 мин. пешком,,,Мосфильмовская ул.,м. Парк Победы
