additionalInfo,address,city,description,district,flatFloor,floorsCount,house,price,remoteness,remotenessType,roomsNumber,squareKitchen,squareLive,squareTotal,street,underground,"Москва, район Хамовники, Сеченовский пер., 2",Москва,"Номер объекта: ОС0218. Шикарная видовая двухуровневая квартира с дизайнерским ремонтом от Филиппа Старка. 1 уровень: выделены зоны отдыха, столовой, кухни, санузел, кабинет с видом на Храм Христа Спасителя, Зачатьевский монастырь, Кремль. Отдельный блок для персонала 40 кв.м с собственным входом. 2 уровень: спальня с действующим камином и выходом на террасу с панорамными видами, гардеробная, санузел. Машиноместо включено в стоимость.",район Хамовники,4,7,д.2,177 129 120,,,3,,,231,Сеченовский пер.,м. Парк Культуры
,"Москва, район Пресненский, Трехпрудный пер., 11/13С2",Москва,"Лот: 15649 Предлагается 4-комнатная квартира на 3 этаже кирпичного дома в районе Патриаршие пруды. Внутреннее пространство выдержано в классическом стиле. В отделке использовались высококачественные материалы. Планировка включает кухню-столовую-гостиную, три спальни и две ванные комнаты. За квартирой закреплено два машиноместа на огороженной территории. Внутренний двор закрыт для посторонних и благоустроен. В подъезде работает консьерж.",район Пресненский,3,5,д.11/13С2,85 000 000,10,пешком,4,,,136,Трехпрудный пер.,м. Маяковская
,"Москва, район Некрасовка, ул. Вертолетчиков, 13",Москва,"СОБСТВЕННОСТЬ ОФОРМЛЕНА. ТОРГ. ВЗАИМОЗАЧЕТ Продается однокомнатная квартира в г. Москва, ЮВАО, район Некрасовка, Люберецкие поля аэрации, кв. 11, к. 8, на 14 этаже, площадь 39.3 кв.м. ОДИН СОБСТВЕННИК. СВОБОДНАЯ ПРОДАЖА.. Квартира класса ""комфорт"" с ЧИСТОВОЙ ОТДЕЛКОЙ с максимально функциональной современной планировкой, просторной кухней, застекленными балконом и эркером. Подъезд чистый, 2 лифта (грузовой и пассажирский). Высота потолков 2,75 м. КВАРТИРА ПОДГОТОВЛЕНА ПОД РЕМОНТ (все несущие перегородки установлены, медная электропроводка разведена по всей квартире, установлены розетки и выключатели, отопительные радиаторы, остеклена лоджия. Ванная установлена, в ванной комнате - деревянная дверь, полотенцесушитель из нержавейки, плитка на полу и стене, в туалете - деревянная дверь, плитка на полу, счетчики учета водоснабжения. Есть домофон, пожарная сигнализация установлена, входная дверь - деревянная. Электросчетчик трехтарифный, в общем коридоре. Окна и балконная дверь из ПВХ-профилей с двухкамерными стеклопакетами. МОСКОВСКАЯ ПРОПИСКА. ОФОРМЛЕНИЕ ВХОДИТ В СТОИМОСТЬ КВАРТИРЫ. Рядом - Люберецкий район с озерами - прекрасное место для прогулок в любое время года. Строится поликлиника. В 5-10 минут езды находятся ""Мега-Белая Дача"", Ашан, Метро, Реал, OBI. Социально благополучные соседи. Ипотека без первоначального взноса. ПЕШКОМ ДО МЕТРО ""НЕКРАСОВКА"" Показы ежедневно с 9.00 до 20.00. СУБСИДИРОВАННАЯ ИПОТЕКА. ИНДИВИДУАЛЬНЫЕ СКИДКИ",район Некрасовка,14,25,д.13,4 669 081,20,на машине,1,,,"39,3",ул. Вертолетчиков,м. Выхино
,"Москва, район Хорошево-Мневники, просп. Маршала Жукова, 43к5",Москва,"Номер объекта: 012538. Предлагается шикарная квартира площадью 127.5 м2 в ЖК Wellton Park. В Квартире выполнен высококачественный дизайнерский ремонт из дорогостоящих материалов в классическом стиле. Расположенно: гостиная, просторная кухня-столовая, 2 спальни, кабинет, три санузла, постирочная, гардеробная комната, балкон. Облагороженная придомовая территория. Современные входные группы. Из окон открываются прекрасные виды на Карамышевскую набережную. Двухуровневый подземный паркинг, в собственности одно м/м, есть возможность приобрести больше. Очень развитая инфраструктура.",район Хорошево-Мневники,11,32,д.43к5,55 000 000,,,4,,,"127,5",просп. Маршала Жукова,м. Октябрьское поле
,"Москва, район Замоскворечье, Шлюзовая наб., 2А",Москва,"Номер объекта: 012296. Предлагается 3-х квартира без отделки 87,20 кв.м на 7 этаже в новостройке в районе Замоскворечья. Окна выходят во двор .",район Замоскворечье,7,7,д.2А,42 439 193,,,3,,,"87,2",Шлюзовая наб.,м. Павелецкая
,"Москва, район Замоскворечье, Шлюзовая наб., 2А",Москва,Номер объекта: 012288. Предлагается апартамент без отделки 43.5 кв.м на 3 этаже в новостройке в районе Замоскворечья. Окна выходят на Кожевнический проезд . Апартамент продается с двумя балконами и он расположен на Юго-Восточной стороне.,район Замоскворечье,3,7,д.2А,16 178 497,,,1,,,"43,5",Шлюзовая наб.,м. Павелецкая
,"Москва, район Замоскворечье, Кожевнический проезд, 4",Москва,"Жилой квартал I&#039;M - это новый проект премиум-класса. Дом СДАН! Выдаем ключи! Эксклюзивный объем. Лучшие условия для приобретения от VSN Realty! Вашему вниманию предлагается однокомнатная квартира, общей площадью - 39.2 кв. м. Все окна в жилом квартале IM панорамные высотой 2,25 метра с французскими балконами. Они впустят больше света в интерьеры жилого квартала и визуально увеличат внутреннее пространство, а также предоставят неограниченные возможности для создания разнообразных интерьерных решений! Жилой квартал расположен в деловом кластере Москвы в трех минутах от Садового кольца. Два элегантных 6 и 7-этажных строения гармонично вписаны в историческую застройку Замоскворечья. Жилой квартал IM создан для Вас харизматичных, целеустремленных и успешных, для нового поколения Москвы! В жилом квартале предусмотрена просторная внутренняя территория площадью 1 га. Голландские ландшафтные архитекторы создают в жилом квартале I&#039;M роскошный сад с зонами для активного и спокойного отдыха. Благодаря сочетанию растений, цветущих в разные периоды времени: уникальные комбинации луговых трав, цветов, парковых, садовых и хвойных деревьев. Сад будет максимально приближен к природному парку и создаст ощущение загородной жизни. Впервые в Москве жителям жилого квартала будет предложен уникальный сервис Clubhouse. Clubhouse общей площадью 250 кв. м. Здесь можно провести деловую встречу, выпить чашку кофе с партнёрами или отпраздновать семейное торжество. По периметру жилого квартала будет установлен изысканный забор высотой 4 м. Двор жилого квартала свободен от машин: все въезжающие автомобили сразу попадают на подземную парковку на 172 м/м. Удачное расположение жилого квартала IM в трех минутах от Садового кольца и десяти минутах от Кремля позволяет оставаться мобильным и быть в центре событий. Ждем Ваших звонков! Звоните!",район Замоскворечье,2,7,д.4,13 932 868,7,пешком,1,6,23,"39,2",Кожевнический проезд,м. Павелецкая
,"Москва, район Хамовники, Садовые Кварталы ЖК",Москва,"Предлагается роскошный пентхаус. В одном из самых семейных комплексов в Москве, ЖК Садовые Кварталы. На первом уровне располагается 2 полностью автономных спальни, гостевой с/у, кухня, столовая, гостиная с действующем камином, и кабинет со своим с/у. На втором уровне возможно расположение от 2 до 3 спален, со своими с/у и зимнего сада. Есть дизайн проект с возможностью его реализация, также возможно изменение концепции. Из окон открываются панорамные виды в сторону Воробьевых Гор, внутренней территории жилого комплекса, а также Воробьевых Гор и центра города. В стоимость включено 2 м/м и кладовое помещение на -3 уровне",район Хамовники,6,12,,175 000 000,10,пешком,,,,351,Садовые Кварталы ЖК,м. Фрунзенская
,"Москва, район Пресненский, Большая Никитская ул., 31",Москва,"Номер объекта: 012049. Предлагается на продажу квартира в фасадном доме, являющимся памятником архитектуры в переулках тихого центра. Окна квартиры выходят Во внутренний двор, на мерзляковский переулок и на Большую Никитскую. В квартире располагается большая гостиная с эркером. Три спальни, 2 с/у. кухня и кладовая. В квартире выполнен дорогостоящий ремонт. Высота потолков 3.6 кв.м",район Пресненский,2,4,д.31,39 500 000,,,4,,,"100,4",Большая Никитская ул.,м. Александровский сад
,,,,,,,,,,,,,,,,
,"Москва, район Басманный, Покровский бул., 5С1",Москва,"Номер объекта: 012287. Предлагается четырехкомнатная квартира в ЖК Резиденция на Покровском бульваре, 140 кв.м, без отдлеки.",район Басманный,2,7,д.5С1,58 982 100,,,4,,,"140,1",Покровский бул.,м. Чкаловская
,"Москва, район Очаково-Матвеевское, Нежинская ул., 1к1",Москва,"Номер объекта: 012303. Предлагается на продажу шикарный двухуровневый видовой пентхаус площадью 335.4 м2. Отделка выполнена по современному дизайн проекту с использованием дорогих материалов. 1 уровень: прихожая, холл, 2 гардеробные комнаты, с/у, кухня, столовая, зал, кабинет, 2 спальни, с/у, постирочная, душевая; 2уровень: большая спальня с отдельным выходом на террасу, ванная комната с джакузи, большая гардеробная, сауна с хромотерапией и комнатой отдыха и с/у. Мебель Италия фабрика Riva, Asnagi, Franchesco Molon, бытовая техника Miele. В стоимость входит 2 парковочных места на подземном паркинге.",район Очаково-Матвеевское,30,31,д.1к1,297 323 880,,,,,,"335,4",Нежинская ул.,м. Славянский бульвар
,"Москва, район Басманный, Покровский бул., 5С1",Москва,"Номер объекта: 012286. Предлагается квартира в ЖК Резиденция на Покровском бульваре, 140,1 кв.м , без отделки.",район Басманный,2,7,д.5С1,24 692 500,,,1,,,"58,1",Покровский бул.,м. Чкаловская
,"Москва, район Хамовники, 2-я Фрунзенская ул., 8",Москва,"Номер объекта: Ф0138. Предлагается квартира площадью 171,6 кв.м. расположенная на 7 этаже комплекса Андреевский дом. Без отделки свободной планировки",район Хамовники,7,12,д.8,193 434 488,,,4,,,"171,6",2-я Фрунзенская ул.,м. Фрунзенская
,"Москва, район Пресненский, Большая Никитская ул., 31",Москва,"Номер объекта: 012052. Предлагается на продажу помещение свободного назначения, на мансардном этаже, в фасадном доме с историей. Окна квартиры, а их 14, выходят во внутренний двор и на Мерзляковский переулок. В квартире со свободной планировкой можно обустроить до 4 спален, кабинет, 3 с/у, гостиную, кухню-столовую. Также есть техническая возможность установки мансарды. Одна квартира на этаже.",район Пресненский,5,5,д.31,63 260 400,,,4,,,240,Большая Никитская ул.,м. Александровский сад
,"Москва, район Пресненский, ул. Сергея Макеева, 9",Москва,"Номер объекта: 009696. Двухкомнатная квартира без отделки 71,3 кв.м на 17 этаже в 5 корпусе. Спланировано: кухня-гостиная, спальня, прихожая, 2 с/у. Из окон открывается вид на Москву-Сити.",район Пресненский,18,21,д.9,36 000 000,,,2,,,"71,4",ул. Сергея Макеева,м. Улица 1905 года
,"Москва, район Тверской, Петровский бул., 21",Москва,"Номер объекта: 010459. Предлагается светлая квартира с большими окнами, свободной планировки площадью 264 кв.м. расположенная на 3 этаже ЖК. Виды ориентированы во внутренний двор, два небольших балкона. Презентабельная входная группа, зеленый двор, охраняемая территория. К квартире предлагаются два машино-места в подземном паркинге.",район Тверской,3,6,д.21,208 759 320,,,5,,,264,Петровский бул.,м. Трубная
,"Москва, район Замоскворечье, Шлюзовая наб., 2А",Москва,"Номер объекта: 012297. Предлагается апартамент с отделкой 46,20 кв.м на 7 этаже в новостройке в районе Замоскворечья. Окна выходят на Кожевнический проезд . Апартамент имеет одну спалью расположен на Юго-Восточной стороне.",район Замоскворечье,7,7,д.2А,20 170 787,,,2,,,"46,2",Шлюзовая наб.,м. Павелецкая
,"Москва, район Басманный, Чистопрудный бул., 15С2",Москва,"Номер объекта: 012335. Предлагается на продажу прекрасная квартира площадью 155м2 в малоквартирном жилом доме на Чистых Прудах. Дом построен в 1912 году по проекту архитектора А.Н. Зелигсона. В квартире кухня, два с/у, просторная гостиная с эркером, столовая с эркером, две спальных комнаты, и кабинет. В квартире очень высокие потолки (3,8м), это придает особую роскошь. Из окон квартиры открываются прекрасные виды на Чистые пруды и во внутренний тихий двор. Огороженная шлагбаумом придомовая территория, полная зеленых насаждений и скамеек. На территории дома есть парковочное место. Очень развитая инфраструктура!",район Басманный,5,6,д.15С2,52 000 000,,,5,,,155,Чистопрудный бул.,м. Сретенский бульвар
,"Москва, район Арбат, Борисоглебский пер., 13С3",Москва,Номер объекта: 012220.,район Арбат,3,5,д.13С3,381 460 212,,,5,,,"241,2",Борисоглебский пер.,м. Баррикадная
,"Москва, район Замоскворечье, Шлюзовая наб., 2А",Москва,"Номер объекта: 012263. Двухкомнатная квартира, общей площадью 75,8 кв.м, свободной планировки, из окон открывается прекрасный вид во двор с ландшафтным дизайном.",район Замоскворечье,7,7,д.2А,34 807 360,,,2,,,"75,8",Шлюзовая наб.,м. Павелецкая
,"Москва, район Замоскворечье, Шлюзовая наб., 2А",Москва,"Номер объекта: 012261. Двухкомнатная квартира, общей площадью 69,74кв.м, свободной планировки, из окон открывается прекрасный вид на Шлюзовую набережную.",район Замоскворечье,5,7,д.2А,33 075 889,,,2,,,"69,7",Шлюзовая наб.,м. Павелецкая
,"Москва, район Замоскворечье, Озерковская наб., 52А",Москва,"Номер объекта: З0239. 3-х комнатная квартира без отделки, свободной планировки, общей площадью 128 кв.м. Возможно спланировать: 2 спальни, гостиную, кухню, кабинет, гардеробную комнату, 2 с/у.",район Замоскворечье,2,8,д.52А,69 586 440,,,3,,,128,Озерковская наб.,м. Павелецкая
,"Москва, район Арбат, Малый Новопесковский пер., 8",Москва,"Номер объекта: 012445. Предлагается к продаже квартира общей площадью 207 кв.м. Выполнена отделка категории DE LUXE в классическом стиле. Эксклюзивная мебель. Большая зона гостиная-кухня-столовая, кабинет с видом на набережную, 2 спальни, 2 санузла. Панорамные окна, роскошные виды. Предусмотрены машиноместа в подземном паркинге. Элитный жилой дом категории De luxe. Современная архитектура отделки фасада с использованием травертина и керамической плитки светлых тонов. Высочайший уровень технического оснащения комплекса, презентабельная входная группа, просторный вестибюль с эффектным витражным остеклением. Во внутренней отделке холлов использованы натуральный камень, ценные панели из оникса и дерева редких пород. Многоуровневая система безопасности, трехуровневый подземный паркинг.",район Арбат,8,14,д.8,303 649 920,,,3,,,207,Малый Новопесковский пер.,м. Смоленская
,"Москва, район Замоскворечье, Руновский пер., 12",Москва,"Номер объекта: З0058. Семикомнатный двухуровневый пентхаус с отделкой общей площадью 343,4 кв.м. На 1-ом этаже: гостиная, оборудованная кухня, 2 спальни, 2 санузла, балкон. На втором этаже: 2 спальни, кабинет, 2 с/у. Окна на две стороны. Потолки 3.40 м. Есть гардеробные комнаты и постирочная. Два машиноместа.",район Замоскворечье,8,9,д.12,221 411 400,,,,,,"343,4",Руновский пер.,м. Новокузнецкая
,"Москва, район Замоскворечье, Шлюзовая наб., 2А",Москва,"Номер объекта: 012259. Предлагается двухкомнатная квартира общей площадью 57 кв.м. Свободная планировка, вид во внутренний двор.",район Замоскворечье,7,7,д.2А,26 174 400,,,2,,,57,Шлюзовая наб.,м. Павелецкая
,"Москва, район Замоскворечье, Шлюзовая наб., 2А",Москва,"Номер объекта: 012258. Однокомнатный апартамент, 43,5 кв.м, 4 окна, 2 балкончика. Свободной планировки.",район Замоскворечье,3,7,д.2А,16 178 497,,,1,,,"43,5",Шлюзовая наб.,м. Павелецкая
